hasil_praktik_4222401040.csv

eksperimen,perubahan,pretrained,mAP50,mAP50-95,precision,recall,inferensi_ms,waktu_latih_menit,imgsz,bobot
E1_pretrained,-,True,0.995,0.995,0.9918,1.0,42.32,15.44,416,C:\Users\ASUS\Documents\Semester 2-8\Semester 5\Computer Vision and Deep Learning (RET503)\Project_1\hasil_praktik\E1_pretrained\weights\best.pt
E3_tuning,imgsz=640,True,0.995,0.995,0.9921,1.0,78.79,103.9,640,C:\Users\ASUS\Documents\Semester 2-8\Semester 5\Computer Vision and Deep Learning (RET503)\Project_1\hasil_praktik\E3_tuning\weights\best.pt

README.md

## 4. Analisis dan Hasil Test

**A. Pemilihan Model Terbaik**
Meskipun eksperimen E1 dan E3 sama-sama mencapai performa luar biasa pada data validasi dengan `mAP50-95` sebesar 0.995 dan `Recall` 100%, **E1 terpilih sebagai model terbaik**. Hal ini karena E1 jauh lebih efisien dari segi waktu pelatihan (15.4 menit vs 103.9 menit pada E3) dan kecepatan inferensi (42.3 ms vs 78.8 ms).

**B. Evaluasi Model pada Data Test**
Pada pengujian akhir menggunakan data test (data yang belum pernah dilihat model), model E1 berhasil mempertahankan performa tinggi dengan perolehan:
*   **mAP50:** 0.995
*   **mAP50-95:** 0.948
Hal ini membuktikan model tidak mengalami *overfitting* dan sangat reliabel untuk mendeteksi objek *path landing* pada gambar baru.

**C. Analisis Fluktuasi Grafik dan Isu Overfitting (Studi Kasus E3)**
Pada grafik hasil eksperimen, terlihat bahwa metrik `mAP50` dan `Recall` sangat stabil dan langsung mencapai nilai maksimal (0.995 dan 1.0). Namun, metrik `mAP50-95` terlihat fluktuatif (naik-turun) dan pada E3 sempat mengalami penurunan (drop) di awal epoch. Berikut adalah analisis mendalam mengenai fenomena tersebut: